"","dist_to_all_rivers.na.mean","dist_to_roads.na.mean","srtm_elevation_500m.na.mean","srtm_slope_500m.na.mean","accessibility_map.na.mean","gpw_v3_density.2000.mean","wdpa_5km.na.sum","treecover2000.na.mean","latitude","longitude","udel_precip_v4_01_yearly_max.2002.mean","udel_precip_v4_01_yearly_min.2002.mean","udel_precip_v4_01_yearly_mean.2002.mean","udel_air_temp_v4_01_yearly_max.2002.mean","udel_air_temp_v4_01_yearly_min.2002.mean","udel_air_temp_v4_01_yearly_mean.2002.mean","v4composites_calibrated.2002.mean","ltdr_yearly_ndvi_mean.2002.mean","treatment","ltdr_yearly_ndvi_mean.2014.mean","propensity","ML.prop","transOutcome","transProp","tree.pred","GEF_ID","Title"
"3",4958.548828125,11815.611328125,1587.0890834192,2.1684122086,523.4903100775,47.876411438,0,0,37.2500625,106,82.15,0,25.1166666667,23.45,-7.25,9.5083333333,0,1240.87072754,1,1093.36047363,0.00878758389851473,0.00878758389851473,124421.056601781,0.00878758389851473,1262.95315763207,956,"PRC-GEF Partnership: Land Degradation in Dryland Ecosystems: Project I-Capacity Building to Combat Land Degradation"
"6",1602.0749511719,7198.4921875,1154.6334033614,4.1818180084,486.138,35.0173835754,0,21.870046125,36.0000578,109,151.8,2.55,48.1708333333,23.4,-4.35,10.8208333333,0,2293.19970703,1,1973.56665039,0.00027385795202783,0.00027385795202783,7206534.02896053,0.00027385795202783,1262.95315763207,956,"PRC-GEF Partnership: Land Degradation in Dryland Ecosystems: Project I-Capacity Building to Combat Land Degradation"
"8",3365.7219238281,7617.630859375,1168.7528205128,5.2286267281,200.726744186,407.6556396484,0,7.7085522124,37.6667341,112.25,119.8,0.3,36.0166666667,20.2,-9.2,6.7666666667,12.440545809,1484.60803223,1,1435.33361816,0.00785638791441241,0.00785638791441241,182696.378258882,0.00785638791441241,1262.95315763207,2369,"PRC-GEF Partnership: An IEM Approach to the Conservation of Biodiversity in Dryland Ecosystems - under the PRC-GEF Partnership on Land Degradation in Dryland Ecosystem Program"
"9",4958.548828125,11815.611328125,1587.0890834192,2.1684122086,523.4903100775,47.876411438,0,0,37.2500625,106,82.15,0,25.1166666667,23.45,-7.25,9.5083333333,0,1240.87072754,1,1093.36047363,0.00878758389851473,0.00878758389851473,124421.056601781,0.00878758389851473,1262.95315763207,2369,"PRC-GEF Partnership: An IEM Approach to the Conservation of Biodiversity in Dryland Ecosystems - under the PRC-GEF Partnership on Land Degradation in Dryland Ecosystem Program"
"32",2058.7607421875,8647.2724609375,2226.9175764192,12.6457481384,445.3823529412,50.278175354,1,0.938149794,32.0000452,-6,105.75,3.475,38.1770833333,19.025,2.475,9.9041666667,0,1619.60144043,1,1361.00708008,0.177312205454553,0.177312205454553,7675.76646283857,0.177312205454553,-931.316399125054,2632,"MENARID: Participatory Control of Desertification and Poverty Reduction in the Arid and Semi Arid High Plateau Ecosystems of Eastern Morocco"
